{
  "contract_version": "response-receipt-v2",
  "message_type": "response_receipt",
  "message_id": "66666666-6666-4666-8666-666666666666",
  "correlation_id": "11111111-1111-4111-8111-111111111111",
  "causation_id": "55555555-5555-4555-8555-555555555555",
  "idempotency_key": "response-receipt.55555555",
  "revision": 1,
  "predecessor": null,
  "created_at": "2026-08-01T03:20:02Z",
  "sender": {
    "system_id": "mineguard-qinyuan",
    "party_id": "regulator-qinyuan",
    "role": "regulatory_platform"
  },
  "recipient": {
    "system_id": "agent-mine-qy-001",
    "party_id": "operator-qy-001",
    "role": "enterprise_agent"
  },
  "mine_id": "MINE-QY-001",
  "payload": {
    "receipt_id": "66666666-6666-4666-8666-666666666661",
    "enterprise_response_message_id": "55555555-5555-4555-8555-555555555555",
    "response_id": "55555555-5555-4555-8555-555555555551",
    "report_id": "33333333-3333-4333-8333-333333333331",
    "recorded_at": "2026-08-01T03:20:01Z",
    "receipt_status": "accepted",
    "disposition": "explanation_recorded",
    "risk_status": "not_cleared_by_receipt",
    "accepted_finding_ids": [
      "33333333-3333-4333-8333-333333333332"
    ],
    "reanalysis_run_id": null
  },
  "signature_envelope": {
    "algorithm": "hmac-sha256-v2",
    "canonicalization": "rfc8785-jcs",
    "key_id": "regulator-key-2026-01",
    "signed_at": "2026-08-01T03:20:02Z",
    "nonce": "BgcICQoLDA0ODxAREhMUFQ",
    "payload_sha256": "8a7a585a0bbeffc62f8e866cb590cd6dbb7b84a0594c241a6b75406ec9fba4d8",
    "signature": "0ebde843d41519864c2054bb0a15466e94eda602fbd465a80c79b6a1ff0c8eaa"
  }
}
